{
  "name": "player_advancement",
  "description": "プレイヤに進捗を達成させます。",
  "base": "player_$base",
  "events": [
    "org.bukkit.event.player.PlayerAdvancementDoneEvent",
    "org.bukkit.event.player.PlayerAdvancementCriterionGrantEvent"
  ],

  "executable": "プレイヤに進捗を達成させるか、または達成度を変更します。",
  "watchable": "プレイヤの進捗が達成されるか、または達成度が変更されるか期待します。",
  "requireable": "プレイヤが進捗または達成度を満たしていることを要求します。",

  "arguments": {
    "player": {
      "type": "playerSpecifier",
      "description": "進捗を達成させるプレイヤです。",
      "requiredOn": ["execute", "require"]
    },
    "advancement": {
      "type": "namespacedKey",
      "description": "達成する進捗です。",
      "requiredOn": ["execute", "require"]
    },
    "criterion": {
      "type": "namespacedKey",
      "description": "達成する条件です。省略した場合は全ての条件を達成します。"
    }
  },
  "outputs": {
    "advancement": {
      "type": "namespacedKey",
      "description": "達成した進捗です。"
    },
    "criterion": {
      "type": "namespacedKey",
      "description": "達成した条件です。"
    }
  }
}
