{
  "name": "server_plugin_enable",
  "description": "サーバのプラグインを有効化します。",
  "events": [
    "org.bukkit.event.server.PluginEnableEvent"
  ],

  "executable": "サーバのプラグインを有効化します。",
  "watchable": "サーバのプラグインが有効化されるか期待します。",
  "requireable": "プラグインが有効であることを要求します。",

  "arguments": {
    "plugin": {
      "type": "string",
      "description": "有効化されるプラグインです。",
      "requiredOn": ["execute", "require"]
    }
  },
  "outputs": {
    "plugin": {
      "type": "string",
      "description": "有効化されたプラグインです。"
    }
  }
}
