{
  "name": "player_item_break",
  "description": "プレイヤにアイテムを破壊させます。",
  "base": "player_$base",
  "events": [
    "org.bukkit.event.player.PlayerItemBreakEvent"
  ],

  "executable": "プレイヤにアイテムを破壊させます。",
  "watchable": "プレイヤがアイテムを破壊するか期待します。",
  "requireable": false,

  "arguments": {
    "item": {
      "type": "itemStack",
      "description": "壊れたアイテムです。"
    },
    "slot": {
      "type": "itemSlot",
      "description": "壊れたアイテムが入っていたスロットです。"
    }
  },
  "outputs": {
    "item": {
      "type": "itemStack",
      "description": "壊れたアイテムです。"
    },
    "slot": {
      "type": "itemSlot",
      "description": "壊れたアイテムが入っていたスロットです。",
      "availableFor": ["execute"]
    }
  }
}
