{
  "name": "player_quit",
  "description": "プレイヤをサーバから退出させます。",
  "base": "player_$base",
  "events": [
    "org.bukkit.event.player.PlayerQuitEvent"
  ],

  "executable": "プレイヤをサーバから退出させます。",
  "watchable": "プレイヤがサーバから退出するか期待します。",
  "requireable": "プレイヤがオフラインであることを要求します。",


  "arguments": {
    "message": {
      "type": "string",
      "description": "プレイヤがサーバーから退出したときに表示するメッセージです。"
    },
    "reason": {
      "type": "string",
      "description": "プレイヤがサーバーから退出した原因です。",
      "enum": [
        "DISCONNECTED",
        "KICKED",
        "TIMED_OUT",
        "ERRONEOUS_STATE"
      ]
    }
  },
  "outputs": {
    "message": {
      "type": "string",
      "description": "プレイヤがサーバーから退出したときに表示されたメッセージです。"
    },
    "reason": {
      "type": "string",
      "description": "プレイヤがサーバーから退出した原因です。",
      "enum": [
        "DISCONNECTED",
        "KICKED",
        "TIMED_OUT",
        "ERRONEOUS_STATE"
      ]
    }
  }
}
