{
  "name": "world_border",
  "description": "ワールドのボーダを変更します。",
  "base": "world_$base",
  "events": [
    "org.bukkit.event.world.WorldBorderBoundsChangeEvent",
    "org.bukkit.event.world.WorldBorderCenterChangeEvent"
  ],

  "executable": "ワールドボーダを変更します。",
  "watchable": "ワールドボーダが変更されるか期待します。",
  "requireable": "ワールドボーダが指定されたものであることを要求します。",

  "arguments": {
    "type": {
      "type": "string",
      "description": "ワールドボーダの変更の種類です。",
      "enum": [
        "STARTED_MOVE",
        "INSTANT_MOVE"
      ],
      "availableFor": ["require"]
    },
    "size": {
      "type": "number",
      "description": "ワールドボーダのサイズです。"
    },
    "sizeOld": {
      "type": "number",
      "description": "ワールドボーダのサイズの変更前の値です。"
    },
    "duration": {
      "type": "number",
      "description": "ワールドボーダの変更にかかる時間です。"
    },
    "center": {
      "description": "ワールドボーダの中心座標です。",
      "type": "location"
    },
    "centerOld": {
      "description": "ワールドボーダの中心座標の変更前の値です。",
      "type": "location"
    }
  },
  "outputs": {
    "type": {
      "type": "string",
      "description": "ワールドボーダの変更の種類です。",
      "enum": [
        "STARTED_MOVE",
        "INSTANT_MOVE"
      ]
    },
    "size": {
      "type": "number",
      "description": "ワールドボーダのサイズです。"
    },
    "sizeOld": {
      "type": "number",
      "description": "ワールドボーダのサイズの変更前の値です。"
    },
    "duration": {
      "type": "number",
      "description": "ワールドボーダの変更にかかる時間です。"
    },
    "center": {
      "description": "ワールドボーダの中心座標です。",
      "type": "location"
    },
    "centerOld": {
      "description": "ワールドボーダの中心座標の変更前の値です。",
      "type": "location"
    }
  }
}
