{
  "name": "entity_spawn",
  "description": "エンティティをスポーンさせます。",
  "events": [
    "org.bukkit.event.entity.EntitySpawnEvent"
  ],

  "executable": "エンティティをスポーンさせます。",
  "watchable": "エンティティがスポーンすることを期待します。",
  "requireable": false,

  "arguments": {
    "entity": {
      "type": "entity",
      "requiredOn": ["execute"]
    }
  },
  "outputs": {
    "entity": {
      "type": "entity"
    }
  }
}
