{
  "name": "player_sprint",
  "description": "プレイヤを走らせます。",
  "base": "player_$base",
  "events": [
    "org.bukkit.event.player.PlayerToggleSprintEvent"
  ],

  "executable": "プレイヤの走り状態を変更します。",
  "watchable": "プレイヤが走るか期待します。",
  "requireable": "プレイヤが走っていることを要求します。",

  "arguments": {
    "sprinting": {
      "type": "boolean",
      "description": "プレイヤが走っているかどうかです。"
    }
  }
}
