{
  "name": "negate",
  "description": "条件要求アクションの判定結果を反転します。",
  "executable": false,
  "watchable": false,
  "requireable": "条件要求アクションの判定結果を反転して取得します。",
  "arguments": {
    "action": {
      "type": "actionKinds",
      "$scenarioKindOf": "require",
      "requiredOn": true
    },
    "with": {
      "type": "actionArgument",
      "description": "アクションの種類によっては、このプロパティにアクションの引数を指定します。"
    }
  }
}
