{
  "name": "player_kick",
  "description": "プレイヤをサーバから強制退出させます。",
  "base": "player_$base",
  "events": [
    "org.bukkit.event.player.PlayerKickEvent"
  ],

  "executable": "プレイヤをサーバから強制退出させます。",
  "watchable": "プレイヤがサーバから強制退出させらるか期待します。",
  "requireable": false,

  "arguments": {
    "leaveMessage": {
      "type": "string",
      "description": "プレイヤがサーバーから退出したときに表示するメッセージです。",
      "availableFor": ["watch"]
    },
    "message": {
      "type": "string",
      "description": "プレイヤがサーバーからキックされたときに表示するメッセージです。",
      "since": "1.16.5"
    }
  },
  "outputs": {
    "leaveMessage": {
      "type": "string",
      "description": "プレイヤがサーバーから退出したときに表示するメッセージです。",
      "availableFor": ["watch"]
    },
    "message": {
      "type": "string",
      "description": "プレイヤがサーバーからキックされたときに表示するメッセージです。",
      "since": "1.16.5"
    }
  }
}
