{
  "name": "server_plugin_disable",
  "description": "サーバのプラグインを無効化します。",
  "events": [
    "org.bukkit.event.server.PluginDisableEvent"
  ],

  "executable": "サーバのプラグインを無効化します。",
  "watchable": "サーバのプラグインが無効化されるか期待します。",
  "requireable": "プラグインが無効であることを要求します。",

  "arguments": {
    "plugin": {
      "type": "string",
      "description": "無効化されるプラグインです。",
      "requiredOn": ["execute", "require"]
    }
  },
  "outputs": {
    "plugin": {
      "type": "string",
      "description": "無効化されたプラグインです。"
    }
  }
}
