{
  "name": "entity_damage_by_entity",
  "description": "エンティティによるダメージをエンティティに与えます。",
  "base": "entity_damage",
  "events": [
    "org.bukkit.event.entity.EntityDamageByEntityEvent"
  ],

  "executable": "エンティティによるダメージをエンティティに与えます。",
  "watchable": "エンティティがエンティティによるダメージを受けることを期待します。",
  "requireable": false,

  "arguments": {
    "damager": {
      "type": "entitySpecifier",
      "description": "ダメージ元のエンティティです。",
      "requiredOn": ["execute"]
    },
    "cause": {
      "requiredOn": false
    }
  },
  "outputs": {
    "damager": {
      "description": "ダメージ元となったエンティティです。",
      "type": "entity"
    }
  }
}
