{
  "name": "player_join",
  "description": "プレイヤをサーバに参加させます。",
  "base": "player_$base",
  "events": [
    "org.bukkit.event.player.PlayerJoinEvent"
  ],

  "executable": "プレイヤをサーバに参加させます。",
  "watchable": "プレイヤがサーバに参加するか期待します。",
  "requireable": "プレイヤがオンラインであることを要求します。",

  "arguments": {
    "message": {
      "type": "string",
      "description": "プレイヤがサーバーに参加したときに表示するメッセージです。"
    }
  },
  "outputs": {
    "message": {
        "type": "string",
        "description": "プレイヤがサーバーに参加したときに表示するメッセージです。"
    }
  }
}
